{
  "feuille": {
    "nord": 48.390857191112936,
    "sud": 48.36441195415008,
    "ouest": 2.636117935180664,
    "est": 2.692422866821289
  },
  "contour": [
    [
      48.37209496092002,
      2.6428985595703125
    ],
    [
      48.3796226475104,
      2.653112411499024
    ],
    [
      48.38623696843915,
      2.664270401000977
    ],
    [
      48.389201729848764,
      2.671136856079102
    ],
    [
      48.3871492211149,
      2.688045501708985
    ],
    [
      48.37945157608451,
      2.6858139038085938
    ],
    [
      48.37825406000634,
      2.6857280731201176
    ],
    [
      48.376999489139195,
      2.6858997344970703
    ],
    [
      48.376144082185675,
      2.6865005493164062
    ],
    [
      48.37409104685752,
      2.6886463165283203
    ],
    [
      48.373406683351305,
      2.6892471313476562
    ],
    [
      48.36741811029687,
      2.6913070678710938
    ],
    [
      48.36679069522185,
      2.6911354064941406
    ],
    [
      48.36559288134223,
      2.6802349090576176
    ],
    [
      48.366163272417346,
      2.6689052581787114
    ],
    [
      48.36627734986583,
      2.6633262634277344
    ],
    [
      48.36479432310514,
      2.6610088348388676
    ],
    [
      48.36468024233491,
      2.659549713134766
    ]
  ],
  "rotation": 0,
  "source": "Rocher_des_Demoiselles.jpg",
  "caleLe": "2026-09-16"
}
